{
  "base_tree_sha256": "93c86fd0fef0fee3bb4aed6c20e231b0e548c8d8181647dab70f7c2809b54a69",
  "capture_created_at": "2026-08-24T10:38:12Z",
  "knowledge_root": "wiki",
  "mode": "preservation",
  "pages": [
    {
      "members": [],
      "page_type": "dataset",
      "source_path": "domains/information-security/datasets/info-sec-engineer-practical-past-exams/00-management/analysis-roadmap-todo.md",
      "source_sha256": "e7f46816dca1f2169f14431ffc1b202fd298a2797858b72552eb5571c84354dc",
      "target_path": "domains/information-security/datasets/info-sec-engineer-practical-past-exams/00-management/analysis-roadmap-todo.md"
    },
    {
      "members": [],
      "page_type": "dataset",
      "source_path": "domains/information-security/datasets/info-sec-engineer-practical-past-exams/00-management/document-architecture.md",
      "source_sha256": "172b4007987618f78c79523892287760b5c934d9f1d2f2bcf002cf14e9995ba2",
      "target_path": "domains/information-security/datasets/info-sec-engineer-practical-past-exams/00-management/document-architecture.md"
    },
    {
      "members": [],
      "page_type": "dataset",
      "source_path": "domains/information-security/datasets/info-sec-engineer-practical-past-exams/00-management/document-management-scaffold.md",
      "source_sha256": "da85dce163492b152fcd12908d9bb5ecda98daf124694b9c4970784f35718357",
      "target_path": "domains/information-security/datasets/info-sec-engineer-practical-past-exams/00-management/document-management-scaffold.md"
    },
    {
      "members": [],
      "page_type": "dataset",
      "source_path": "domains/information-security/datasets/info-sec-engineer-practical-past-exams/00-management/document-physical-migration-plan.md",
      "source_sha256": "1bcc5441f989c67a1decd166cf1b6ef227131caf4441d28222ed694a162602aa",
      "target_path": "domains/information-security/datasets/info-sec-engineer-practical-past-exams/00-management/document-physical-migration-plan.md"
    },
    {
      "members": [],
      "page_type": "dataset",
      "source_path": "domains/information-security/datasets/info-sec-engineer-practical-past-exams/01-rounds/2013-01-practical-01.md",
      "source_sha256": "f987d81b5198bdf5e914e7004200da1b5f606d38af6971325564e37fcba2f772",
      "target_path": "domains/information-security/datasets/info-sec-engineer-practical-past-exams/01-rounds/2013-01-practical-01.md"
    },
    {
      "members": [],
      "page_type": "dataset",
      "source_path": "domains/information-security/datasets/info-sec-engineer-practical-past-exams/01-rounds/2013-02-practical-02.md",
      "source_sha256": "989ccc2392138d2b177bb9401cccd5425302ef504a3598165d617e8fc0ce0ac0",
      "target_path": "domains/information-security/datasets/info-sec-engineer-practical-past-exams/01-rounds/2013-02-practical-02.md"
    },
    {
      "members": [],
      "page_type": "dataset",
      "source_path": "domains/information-security/datasets/info-sec-engineer-practical-past-exams/01-rounds/2014-01-practical-03.md",
      "source_sha256": "2a672daff5a00a0381ac8cbd133839560aaeb44c5c6408d14396bbead6b424b8",
      "target_path": "domains/information-security/datasets/info-sec-engineer-practical-past-exams/01-rounds/2014-01-practical-03.md"
    },
    {
      "members": [],
      "page_type": "dataset",
      "source_path": "domains/information-security/datasets/info-sec-engineer-practical-past-exams/01-rounds/2014-02-practical-04.md",
      "source_sha256": "d4a8cae1cbaf1744705a92899210939c0a495ec0d6efb6ccaf7738cdcf443038",
      "target_path": "domains/information-security/datasets/info-sec-engineer-practical-past-exams/01-rounds/2014-02-practical-04.md"
    },
    {
      "members": [],
      "page_type": "dataset",
      "source_path": "domains/information-security/datasets/info-sec-engineer-practical-past-exams/01-rounds/2015-01-practical-05.md",
      "source_sha256": "28b9b40ff0fa19bae22af74668ca6b35c4283043a967f88dbf72399838d3ccd2",
      "target_path": "domains/information-security/datasets/info-sec-engineer-practical-past-exams/01-rounds/2015-01-practical-05.md"
    },
    {
      "members": [],
      "page_type": "dataset",
      "source_path": "domains/information-security/datasets/info-sec-engineer-practical-past-exams/01-rounds/2015-02-practical-06.md",
      "source_sha256": "edbd036cbc7fccabf130006336b0c5bd5239f1d63e70627de9aafe12157dfab6",
      "target_path": "domains/information-security/datasets/info-sec-engineer-practical-past-exams/01-rounds/2015-02-practical-06.md"
    },
    {
      "members": [],
      "page_type": "dataset",
      "source_path": "domains/information-security/datasets/info-sec-engineer-practical-past-exams/01-rounds/2016-01-practical-07.md",
      "source_sha256": "84b0c6271c1f63d8d3fb75ea784d2cba446dad95670e7318ce6ad28e5dafc628",
      "target_path": "domains/information-security/datasets/info-sec-engineer-practical-past-exams/01-rounds/2016-01-practical-07.md"
    },
    {
      "members": [],
      "page_type": "dataset",
      "source_path": "domains/information-security/datasets/info-sec-engineer-practical-past-exams/01-rounds/2016-02-practical-08.md",
      "source_sha256": "d8ac428080f74a3bf3babc88fc67c8a3fa40dc818cf5633bd56b72df43fac4c6",
      "target_path": "domains/information-security/datasets/info-sec-engineer-practical-past-exams/01-rounds/2016-02-practical-08.md"
    },
    {
      "members": [],
      "page_type": "dataset",
      "source_path": "domains/information-security/datasets/info-sec-engineer-practical-past-exams/01-rounds/2017-01-practical-09.md",
      "source_sha256": "cd4f74a4769f3740eedd9855046e8879345e12fefb8eddecf0ca521aa1f4a485",
      "target_path": "domains/information-security/datasets/info-sec-engineer-practical-past-exams/01-rounds/2017-01-practical-09.md"
    },
    {
      "members": [],
      "page_type": "dataset",
      "source_path": "domains/information-security/datasets/info-sec-engineer-practical-past-exams/01-rounds/2017-02-practical-10.md",
      "source_sha256": "87e712874f7a733c2ea410faeecdee52864dfbeb25309415e199b338f4b3aeb0",
      "target_path": "domains/information-security/datasets/info-sec-engineer-practical-past-exams/01-rounds/2017-02-practical-10.md"
    },
    {
      "members": [],
      "page_type": "dataset",
      "source_path": "domains/information-security/datasets/info-sec-engineer-practical-past-exams/01-rounds/2018-01-practical-11.md",
      "source_sha256": "73b1b38e4856918a09d02431c1d4fe002e639c244d3c6cc85803874ad027ffb8",
      "target_path": "domains/information-security/datasets/info-sec-engineer-practical-past-exams/01-rounds/2018-01-practical-11.md"
    },
    {
      "members": [],
      "page_type": "dataset",
      "source_path": "domains/information-security/datasets/info-sec-engineer-practical-past-exams/01-rounds/2018-02-practical-12.md",
      "source_sha256": "a1b53173076125d35862f545d9e1027079f80b3c2ea9b4a6d346247b1691d665",
      "target_path": "domains/information-security/datasets/info-sec-engineer-practical-past-exams/01-rounds/2018-02-practical-12.md"
    },
    {
      "members": [],
      "page_type": "dataset",
      "source_path": "domains/information-security/datasets/info-sec-engineer-practical-past-exams/01-rounds/2019-01-practical-13.md",
      "source_sha256": "4b661dd182ba73a3e55161ec16b7a8e2b062342a35e872aeb4025989487b6fcc",
      "target_path": "domains/information-security/datasets/info-sec-engineer-practical-past-exams/01-rounds/2019-01-practical-13.md"
    },
    {
      "members": [],
      "page_type": "dataset",
      "source_path": "domains/information-security/datasets/info-sec-engineer-practical-past-exams/01-rounds/2019-02-practical-14.md",
      "source_sha256": "b4902454ababea8870b7f167f8c82e29175e87cccd868b286c6231ba4dff9281",
      "target_path": "domains/information-security/datasets/info-sec-engineer-practical-past-exams/01-rounds/2019-02-practical-14.md"
    },
    {
      "members": [],
      "page_type": "dataset",
      "source_path": "domains/information-security/datasets/info-sec-engineer-practical-past-exams/01-rounds/2020-01-practical-15.md",
      "source_sha256": "cd37befcd1fa35d4a1b22027ff5707c4a0dd1377ae6a7d4db77092c273bcf37b",
      "target_path": "domains/information-security/datasets/info-sec-engineer-practical-past-exams/01-rounds/2020-01-practical-15.md"
    },
    {
      "members": [],
      "page_type": "dataset",
      "source_path": "domains/information-security/datasets/info-sec-engineer-practical-past-exams/01-rounds/2020-02-practical-16.md",
      "source_sha256": "7d00894d8b876d04a093feaf78075a5dbd6ad49cebd10b3e66d52fa2d4e639ce",
      "target_path": "domains/information-security/datasets/info-sec-engineer-practical-past-exams/01-rounds/2020-02-practical-16.md"
    },
    {
      "members": [],
      "page_type": "dataset",
      "source_path": "domains/information-security/datasets/info-sec-engineer-practical-past-exams/01-rounds/2021-01-practical-17.md",
      "source_sha256": "55128190044a3069368d4925dceaeb1abd76af3b9d7552413b2883230751eab8",
      "target_path": "domains/information-security/datasets/info-sec-engineer-practical-past-exams/01-rounds/2021-01-practical-17.md"
    },
    {
      "members": [],
      "page_type": "dataset",
      "source_path": "domains/information-security/datasets/info-sec-engineer-practical-past-exams/01-rounds/2021-02-practical-18.md",
      "source_sha256": "f668712790924ff9e13e422add0cfea176d5bbe377df7efe18a84bd1c82446fa",
      "target_path": "domains/information-security/datasets/info-sec-engineer-practical-past-exams/01-rounds/2021-02-practical-18.md"
    },
    {
      "members": [],
      "page_type": "dataset",
      "source_path": "domains/information-security/datasets/info-sec-engineer-practical-past-exams/01-rounds/2022-01-practical-19.md",
      "source_sha256": "22058df05d5123ff23b1231d4569ee4b7405724ac1ad3b105efe0f51a17565aa",